{
  "schema_version": 1,
  "agent_id": "catalyst_analyst",
  "task_id": "aero-catalysts-2026-10-16",
  "status": "PARTIAL",
  "asset_scope": [{"asset_id": "Aerodrome Finance (AERO) project; token identity and chain not independently verified in this event search"}],
  "claims": [],
  "observations": [
    {"id": "gdelt-query-1", "source": "GDELT DOC API via configured GDELT MCP", "tool": "mcp__gdelt__gdelt_search_articles", "upstream_provenance": "GDELT DOC API; request ID XRC3J-E35ZN", "asset_id": "Aerodrome Finance (AERO) project", "venue": null, "metric": "Event-discovery query outcome", "value": {"query": "\"Aerodrome Finance\" OR \"Aerodrome\" (Base OR AERO)", "startDatetime": "20260925000000", "endDatetime": "20261016235959", "maxRecords": 30, "sort": "dateDesc", "result": "HTTP 429 rate limited; no articles returned"}, "unit": "tool response", "observed_at_utc": "2026-10-16T11:17:01Z", "retrieved_at_utc": "2026-10-16T11:17:01Z", "methodology": "Bounded GDELT DOC article search, covering the 21-day research window. GDELT is discovery only and would not establish that an event occurred.", "coverage": "No article records, URLs, publication timestamps, or event timestamps were returned. Upstream request ID: XRC3J-E35ZN."},
    {"id": "gdelt-query-2", "source": "GDELT DOC API via configured GDELT MCP", "tool": "mcp__gdelt__gdelt_search_articles", "upstream_provenance": "GDELT DOC API; request ID A1GFA-0S7JP", "asset_id": "Aerodrome Finance (AERO) project", "venue": null, "metric": "Event-discovery retry outcome", "value": {"query": "\"Aerodrome Finance\" OR \"Aerodrome\" (Base OR AERO)", "startDatetime": "20260925000000", "endDatetime": "20261016235959", "maxRecords": 30, "sort": "dateDesc", "result": "HTTP 429 rate limited again; no articles returned"}, "unit": "tool response", "observed_at_utc": "2026-10-16T11:17:01Z", "retrieved_at_utc": "2026-10-16T11:17:01Z", "methodology": "One retry after waiting 6.5 seconds, following the provider's returned recovery hint.", "coverage": "No article records, URLs, publication timestamps, or event timestamps were returned. Upstream request ID: A1GFA-0S7JP."}
  ],
  "conflicts": [],
  "coverage_gaps": [
    {"id": "gap-gdelt-rate-limited", "description": "GDELT discovery was attempted twice; both requests returned HTTP 429. No recent developments could be discovered or checked for duplicate/syndicated reporting."},
    {"id": "gap-primary-sources", "description": "No original Aerodrome announcements or other primary sources were obtained. Event occurrence, publication time, actual event time, upcoming dated catalysts within 21 days, and catalyst invalidation or delay conditions remain unverified."},
    {"id": "gap-catalyst-coverage", "description": "No catalysts are asserted. Recent news and scheduled events could not be established from returned evidence."}
  ],
  "tool_calls": [{"tool": "mcp__gdelt__gdelt_search_articles", "source": "Configured GDELT MCP / GDELT DOC API", "outcome": "ERROR", "call_count": 2, "retrieved_at_utc": "2026-10-16T11:17:01Z", "reason": "Both bounded searches returned HTTP 429 rate limited with no article results. Request IDs XRC3J-E35ZN and A1GFA-0S7JP."}]
}
